{
  "mapping_id": "mta_ontology_demo_field_mapping",
  "version": "1.0.0",
  "datasets": [
    {"dataset_id":"ads_daily","path":"docs/marketing-roi-analysis-mta_-/modules/amc_mta/data/simulated/amazon_ads_report_sample.csv","grain":"reportDate + normalizedTouchpoint","time_window":"daily rows, 2026-01-01..2026-12-31","key_fields":["reportDate","accountId","normalizedTouchpoint"],"expected_headers":["reportDate","marketplace","accountId","adProduct","adType","creativeType","inventoryType","placement","interaction_type","cost_type","normalizedTouchpoint","currencyCode","impressions","clicks","cost","purchases","sales"],"owner":"mta_team"},
    {"dataset_id":"amc_events","path":"docs/marketing-roi-analysis-mta_-/modules/amc_mta/data/simulated/amc_touchpoint_events_sample.csv","grain":"journey event (local synthetic input only)","time_window":"event timestamp within synthetic annual fixture","key_fields":["journey_id","event_type","event_time"],"expected_headers":["journey_id","event_type","event_time","ad_product","format","placement","creative","interaction_type","marketplace","advertiser_id","users","converted_users","purchase_count","revenue","new_to_brand_purchases"],"owner":"mta_team"},
    {"dataset_id":"amc_paths","path":"docs/marketing-roi-analysis-mta_-/modules/amc_mta/data/simulated/amc_mta_path_report_raw_sample.csv","grain":"anonymous aggregated five-segment path","time_window":"report_start_date..report_end_date (current annual fixture)","key_fields":["report_start_date","report_end_date","advertiser_id","path"],"expected_headers":["report_start_date","report_end_date","marketplace","advertiser_id","path","users","converted_users","purchase_count","revenue"],"owner":"mta_team"},
    {"dataset_id":"markov_results","path":"docs/marketing-roi-analysis-mta_-/modules/amc_mta/outputs/attribution/amc_markov_attribution_results.csv","grain":"five-segment touchpoint snapshot","time_window":"current full report window; no per-row dates","key_fields":["attribution_model","touchpoint"],"expected_headers":["attribution_model","touchpoint","interaction_type","converted_user_share","purchase_count_share","revenue_share","attributed_converted_users","attributed_purchase_count","attributed_revenue","impressions","clicks","cost","reported_purchases","reported_sales","roas","roi","cpa","cost_per_converted_user"],"owner":"mta_team"},
    {"dataset_id":"shapley_results","path":"docs/marketing-roi-analysis-mta_-/modules/amc_mta/outputs/attribution/amc_shapley_attribution_results.csv","grain":"five-segment touchpoint snapshot","time_window":"current full report window; no per-row dates","key_fields":["attribution_model","touchpoint"],"expected_headers":["attribution_model","touchpoint","interaction_type","converted_user_share","purchase_count_share","revenue_share","attributed_converted_users","attributed_purchase_count","attributed_revenue","impressions","clicks","cost","reported_purchases","reported_sales","roas","roi","cpa","cost_per_converted_user"],"owner":"mta_team"},
    {"dataset_id":"comparison_touchpoints","path":"docs/marketing-roi-analysis-mta_-/modules/amc_mta/outputs/attribution/amc_mta_model_comparison_touchpoints.csv","grain":"five-segment touchpoint + outcome snapshot","time_window":"current full report window; dates inherited, not present","key_fields":["touchpoint","outcome"],"expected_headers":["touchpoint","outcome","markov_share","shapley_share","gap_pp","relative_gap","raw_unique_paths","raw_converted_users","raw_purchase_count","calculation_valid","data_support_sufficient","models_consistent","reliability_status","reliability_reason"],"owner":"mta_team"},
    {"dataset_id":"comparison_summary","path":"docs/marketing-roi-analysis-mta_-/modules/amc_mta/outputs/attribution/amc_mta_model_comparison_summary.csv","grain":"outcome snapshot","time_window":"explicit report_start_date..report_end_date","key_fields":["outcome"],"expected_headers":["outcome","report_start_date","report_end_date","max_touchpoint_gap_days","touchpoint_count","tvd","spearman_rho","top_k_overlap_rate","calculation_valid","data_support_sufficient","models_consistent","reliability_status","reliability_reason"],"owner":"mta_team"},
    {"dataset_id":"recommended_attribution","path":"docs/marketing-roi-analysis-mta_-/modules/amc_mta/outputs/attribution/amc_mta_recommended_attribution.csv","grain":"five-segment touchpoint + outcome snapshot","time_window":"current full report window; dates inherited, not present","key_fields":["touchpoint","outcome"],"expected_headers":["touchpoint","interaction_type","outcome","official_model","official_share","recommended_value","benchmark_model","benchmark_share","gap_pp","relative_gap","calculation_valid","data_support_sufficient","models_consistent","reliability_status","reliability_reason"],"owner":"mta_team"}
  ],
  "mappings": [
    {"mapping_id":"FM-REPORT-DATE","concept_id":null,"etl_identifier":"report_date","strategy":"rename","source_dataset":"ads_daily","source_fields":["reportDate"],"source_grain":"daily touchpoint","target_grain":"daily touchpoint","time_window":"daily","transform":"ISO date alias","null_behavior":"reject null","supported_rules":[],"ownership":"mta_team","status":"reusable","blocker":null,"workaround":null},
    {"mapping_id":"FM-ACCOUNT","concept_id":null,"etl_identifier":"account_id","strategy":"rename","source_dataset":"ads_daily","source_fields":["accountId"],"source_grain":"daily touchpoint","target_grain":"account identifier","time_window":"daily","transform":"string alias; reconcile with advertiser_id","null_behavior":"reject null","supported_rules":[],"ownership":"mta_team","status":"reusable","blocker":null,"workaround":null},
    {"mapping_id":"FM-TOUCHPOINT","concept_id":null,"etl_identifier":"touchpoint","strategy":"rename","source_dataset":"ads_daily","source_fields":["normalizedTouchpoint"],"source_grain":"daily five-segment touchpoint","target_grain":"five-segment touchpoint","time_window":"daily","transform":"preserve all five colon-separated segments verbatim","null_behavior":"reject null or malformed key","supported_rules":["R3","R5"],"ownership":"mta_team","status":"reusable","blocker":null,"workaround":null},
    {"mapping_id":"FM-SPEND","concept_id":"spend","etl_identifier":null,"strategy":"rename","source_dataset":"ads_daily","source_fields":["cost"],"source_grain":"daily touchpoint","target_grain":"daily touchpoint; campaign unavailable","time_window":"daily","transform":"decimal cost renamed to spend","null_behavior":"reject null; zero is valid","supported_rules":["R1","R4"],"ownership":"ontology_team","status":"reusable","blocker":null,"workaround":"aggregate only after a campaign key is supplied"},
    {"mapping_id":"FM-IMPRESSIONS","concept_id":"impressions","etl_identifier":null,"strategy":"direct","source_dataset":"ads_daily","source_fields":["impressions"],"source_grain":"daily touchpoint","target_grain":"daily touchpoint; campaign unavailable","time_window":"daily","transform":"identity","null_behavior":"reject null; zero is valid","supported_rules":["R1","R2"],"ownership":"ontology_team","status":"reusable","blocker":null,"workaround":"aggregate only after a campaign key is supplied"},
    {"mapping_id":"FM-CLICKS","concept_id":"clicks","etl_identifier":null,"strategy":"direct","source_dataset":"ads_daily","source_fields":["clicks"],"source_grain":"daily touchpoint","target_grain":"daily touchpoint; campaign unavailable","time_window":"daily","transform":"identity","null_behavior":"reject null; zero is valid","supported_rules":["R1","R6"],"ownership":"ontology_team","status":"reusable","blocker":null,"workaround":"aggregate only after a campaign key is supplied"},
    {"mapping_id":"FM-CONVERSIONS","concept_id":"conversions","etl_identifier":null,"strategy":"rename","source_dataset":"ads_daily","source_fields":["purchases"],"source_grain":"daily touchpoint","target_grain":"daily touchpoint; campaign unavailable","time_window":"daily","transform":"platform purchases renamed to conversions","null_behavior":"reject null; zero is valid","supported_rules":["R6"],"ownership":"ontology_team","status":"reusable","blocker":null,"workaround":"aggregate only after a campaign key is supplied"},
    {"mapping_id":"FM-REVENUE","concept_id":"revenue","etl_identifier":null,"strategy":"rename","source_dataset":"ads_daily","source_fields":["sales"],"source_grain":"daily touchpoint","target_grain":"daily touchpoint; campaign unavailable","time_window":"daily","transform":"platform sales renamed to revenue","null_behavior":"reject null; zero is valid","supported_rules":["R1","R4"],"ownership":"ontology_team","status":"reusable","blocker":null,"workaround":"aggregate only after a campaign key is supplied"},
    {"mapping_id":"FM-ACOS","concept_id":"acos","etl_identifier":null,"strategy":"unsupported_grain","source_dataset":"ads_daily","source_fields":["cost","sales"],"source_grain":"daily touchpoint","target_grain":"campaign 14day","time_window":"14day","transform":"sum(cost) / sum(sales); if denominator zero return null and do not trigger","null_behavior":"null on zero revenue","supported_rules":["R1"],"ownership":"shared_pending_agreement","status":"blocked","blocker":"Ads sample has no campaign ID, so campaign windows cannot be formed","workaround":"use Demo assertion fixture until campaign identifier is added"},
    {"mapping_id":"FM-CTR","concept_id":"ctr","etl_identifier":null,"strategy":"unsupported_grain","source_dataset":"ads_daily","source_fields":["clicks","impressions"],"source_grain":"daily touchpoint","target_grain":"campaign 14day","time_window":"14day","transform":"sum(clicks) / sum(impressions); if denominator zero return null","null_behavior":"null on zero impressions","supported_rules":["R1"],"ownership":"shared_pending_agreement","status":"blocked","blocker":"Ads sample has no campaign ID","workaround":"use Demo assertion fixture until campaign identifier is added"},